{
  "id": "b3e7c8a1-4d5f-6e7a-8b9c-0d1e2f3a4b5c",
  "title": "Journey to Dzaleka: A Story of Hope",
  "type": "story",
  "description": "An oral history account of a Congolese family's journey from Bukavu to Dzaleka Refugee Camp in 2015. The narrator describes the challenges of displacement, the experience of crossing borders, and the sense of community found upon arrival at Dzaleka. This story captures themes of resilience, loss, and rebuilding life in a new place.",
  "language": "en",
  "creator": [
    {
      "name": "Marie Consolée",
      "role": "narrator"
    },
    {
      "name": "Jean-Baptiste Mushimiyimana",
      "role": "interviewer",
      "affiliation": "Dzaleka Digital Heritage Project"
    }
  ],
  "date": {
    "created": "2024-03-15",
    "event_date": "2015-08-22"
  },
  "subject": [
    "oral history",
    "displacement",
    "Congo",
    "journey",
    "resilience",
    "community",
    "arrival"
  ],
  "location": {
    "name": "Dzaleka Refugee Camp",
    "area": "Community Center",
    "latitude": -13.7833,
    "longitude": 33.9833
  },
  "format": "text/plain",
  "rights": {
    "license": "CC-BY-NC-4.0",
    "access_level": "public",
    "holder": "Marie Consolée"
  },
  "source": {
    "contributor": "Dzaleka Digital Heritage Project",
    "collection": "Oral Histories 2024",
    "original_format": "audio interview (transcribed)"
  },
  "coverage": {
    "start_date": "2015-01-01",
    "end_date": "2015-12-31",
    "period": "2015 displacement and arrival"
  },
  "schema_version": "1.0.0"
}
